{
  "$id": "https://skill-tree.app/schemas/task.json",
  "$schema": "https://json-schema.org/draft/2020-12/schema",
  "title": "AI Task Monitor Task Definition",
  "type": "object",
  "additionalProperties": false,
  "required": [
    "task_id",
    "title",
    "description",
    "created",
    "status",
    "priority",
    "inputs",
    "outputs",
    "acceptance_criteria",
    "notes"
  ],
  "properties": {
    "task_id": {
      "type": "string",
      "pattern": "^TASK_[A-Za-z0-9_]+$"
    },
    "title": {
      "type": "string",
      "minLength": 1
    },
    "description": {
      "type": "string",
      "minLength": 1
    },
    "created": {
      "type": "string",
      "minLength": 1,
      "description": "ISO8601 timestamp preferred"
    },
    "status": {
      "type": "string",
      "enum": [
        "pending",
        "in_progress",
        "blocked",
        "completed"
      ]
    },
    "priority": {
      "type": "string",
      "enum": [
        "low",
        "medium",
        "high",
        "urgent"
      ]
    },
    "inputs": {
      "type": "object",
      "additionalProperties": false,
      "required": [
        "files",
        "context"
      ],
      "properties": {
        "files": {
          "type": "array",
          "items": {
            "type": "string",
            "minLength": 1
          }
        },
        "context": {
          "type": "array",
          "items": {
            "type": "string",
            "minLength": 1
          }
        }
      }
    },
    "outputs": {
      "type": "object",
      "additionalProperties": false,
      "required": [
        "expected_files",
        "expected_changes"
      ],
      "properties": {
        "expected_files": {
          "type": "array",
          "items": {
            "type": "string",
            "minLength": 1
          }
        },
        "expected_changes": {
          "type": "array",
          "items": {
            "type": "string",
            "minLength": 1
          }
        }
      }
    },
    "acceptance_criteria": {
      "type": "array",
      "minItems": 1,
      "items": {
        "type": "string",
        "minLength": 1
      }
    },
    "notes": {
      "type": "array",
      "items": {
        "type": "string",
        "minLength": 1
      }
    }
  }
}
