{
    "task_id": "TASK_001_requirements_architecture",
    "title": "Define Requirements and Architecture Baseline",
    "description": "Capture roles, data sources, and the dual-deployment workflow, and select the tech stack for the AI Task Monitor per the TODO roadmap.",
    "created": "2026-01-09T22:11:00Z",
    "status": "completed",
    "priority": "high",
    "inputs": {
      "files": [
        "ai/AI_TASK_MONITOR_CONTRACT.md",
        "ai/TO-DO.md"
      ],
      "context": [
        "Stakeholder expectations for local editor vs remote observer",
        "Existing filesystem layout under ai/",
        "Deployment pipeline constraints (local write access vs remote read-only)"
      ]
    },
    "outputs": {
      "expected_files": [
        "docs/requirements_architecture.md",
        "docs/schema_strategy.md",
        "docs/risk_log.md"
      ],
      "expected_changes": [
        "Documented user roles (local editor, remote observer) and authority boundaries",
        "Enumerated data sources (ai/ files, GitHub artifacts) with access modes and owners",
        "Dual-deployment workflow map with technology stack decision (Next.js or similar)",
        "Risk assessment noting schema, deployment, or tooling gaps"
      ]
    },
    "acceptance_criteria": [
      "Architecture doc references both deployments and traces user roles and workflows end-to-end.",
      "Approved schema strategy captured with explicit data sources and validation checkpoints.",
      "Tech stack decision logged with rationale (e.g., framework, API layer).",
      "Risks for requirements/architecture captured with owners or mitigation ideas."
    ],
    "notes": [
      "Use Machine Summary Blocks on every new Markdown doc produced by this task.",
      "Coordinate with schema owners so the architecture doc aligns with upcoming schema work.",
      "Keep references to ai/AI_TASK_MONITOR_CONTRACT.md to ensure alignment with the execution contract."
    ]
  }
